{
  "schema_version": "1.0",
  "year": 2017,
  "title": "The Year the Bills Came Due",
  "era": "platform-era",
  "narrative": "Equifax exposed 147 million Americans. WannaCry crippled hospitals worldwide. The FCC killed net neutrality. Bitcoin went parabolic. #MeToo proved social media could drive real change. Alexa moved into millions of homes. The internet's consequences \u2014 and its power \u2014 became impossible to ignore.",
  "felt_like": {
    "os": "Windows 10 Fall Creators / iOS 11 / macOS High Sierra",
    "browser": "Chrome (dominating 60%+ market share) / Safari",
    "messenger": "Discord (server boom) / WhatsApp / iMessage / Slack",
    "social_network": "Instagram Stories overtakes Snapchat / Musical.ly / Twitter expands to 280 characters",
    "music": "Luis Fonsi 'Despacito', Kendrick Lamar 'HUMBLE.', Ed Sheeran 'Shape of You'",
    "phone": "iPhone X ($999, Face ID, notch, no home button) & Samsung Galaxy S8",
    "video": "YouTube livestreaming / Netflix interactive shows / Twitch IRL streaming",
    "website": "CSS Grid layout officially supported across browsers, smooth web animations",
    "fashion": "Balenciaga Triple S 'chunky dad sneakers', bike shorts, tiny Matrix sunglasses",
    "gadget": "Nintendo Switch & Apple iPhone X",
    "news": "Solar eclipse across America; Hurricane Maria in Puerto Rico; Las Vegas shooting",
    "culture": "Fidget spinner mania in every school; Jordan Peele's Get Out"
  },
  "events": [
    "equifax-breach-2017",
    "bitcoin-boom-2017",
    "metoo-2017",
    "alexa-mainstream-2017",
    "gdpr-announced-2017",
    "blueborne-2017",
    "wannacry-2017",
    "snapchat-ipo-2017",
    "fcc-net-neutrality-2017",
    "slack-bots-2017",
    "nintendo-switch-zelda-botw-2017",
    "fidget-spinner-craze-2017",
    "despacito-latin-pop-streaming-2017",
    "iphone-x-2017"
  ]
}
