{
  "schema_version": "1.0",
  "year": 2000,
  "title": "The Year the Bubble Peaked",
  "era": "bust-rebuild",
  "narrative": "The NASDAQ hits its all-time high in March, then everything that was built on hype starts to wobble. AOL buys Time Warner in the largest merger in history. Napster makes music free for 80 million people. Broadband quietly passes five million homes and the always-on Internet begins.",
  "felt_like": {
    "os": "Windows 98 / Windows 2000 / Mac OS 9",
    "browser": "Internet Explorer 5.5 / Netscape 6",
    "messenger": "AIM / ICQ 2000 / MSN Messenger",
    "social_network": "Napster / LiveJournal / Webring forums",
    "music": "Napster MP3s, Eminem, Outkast, burned CD-Rs with Sharpie labels",
    "phone": "Nokia 3310 with Snake II & custom monochromatic ringtones",
    "video": "RealPlayer buffering clips & Blockbuster DVD rentals",
    "website": "Flash intro splash screens, 800x600 resolution banners, visitor counters",
    "fashion": "Y2K metallics, low-rise cargo pants, bandana halter tops, visor sunglasses",
    "gadget": "Sony PlayStation 2 & Nokia 3310",
    "news": "Bush vs. Gore Florida recount election; Dot-com bubble collapses",
    "culture": "Cast Away, Gladiator, Survivor season one finale attracts 51M viewers"
  },
  "events": [
    "dotcom-bubble-peak-2000",
    "mac-osx-launch-2000",
    "playstation2-launch-2000",
    "broadband-tipping-point-2000",
    "aol-time-warner-merger-2000",
    "napster-peak-2000",
    "w3c-css2-spec-2000",
    "mobile-internet-wap-2000",
    "nokia-3310-snake-2000",
    "bush-gore-election-hanging-chads-2000",
    "eminem-marshall-mathers-outkast-2000"
  ]
}
