{
  "schema_version": "1.0",
  "year": 2002,
  "title": "The Year Blogging Began",
  "era": "bust-rebuild",
  "narrative": "The wreckage of the crash clears and something quieter takes root. Blogging tools make publishing personal, LinkedIn makes your career a network, camera phones put a lens in every pocket, and Wi-Fi untethers the laptop. The web stops being a place you visit and starts being something you carry.",
  "felt_like": {
    "os": "Windows XP / Mac OS X Jaguar",
    "browser": "Internet Explorer 6 / Safari",
    "messenger": "MSN Messenger",
    "social_network": "Friendster / Blogger",
    "music": "iPod / Winamp",
    "phone": "Nokia 7650 (camera phone)",
    "video": "RealPlayer / Windows Media",
    "website": "Moveable Type blogs, permalinks, RSS"
  },
  "events": [
    "linkedin-launch-2002",
    "mac-osx-jaguar-2002",
    "camera-phone-era-2002",
    "tablet-pc-launch-2002",
    "xbox-live-launch-2002",
    "wifi-standard-802.11-2002",
    "blog-blogger-boom-2002",
    "enron-scandal-2002"
  ]
}
