{
  "schema_version": "1.0",
  "year": 1997,
  "title": "The Dot-Com Boom & Rise of E-Commerce",
  "era": "early-web",
  "narrative": "Amazon goes public. Netflix is born. Bluetooth untethers devices from cables. AIM connects millions. RealPlayer streams live video. The first weblogs appear. The internet stops being a novelty and starts becoming infrastructure.",
  "felt_like": {
    "os": "Windows 95 / Windows 98 beta / Mac OS 8",
    "browser": "Internet Explorer 4.0 / Netscape Communicator",
    "messenger": "AOL Instant Messenger (AIM) / ICQ",
    "social_network": "SixDegrees.com / GeoCities communities",
    "music": "The Notorious B.I.G., Radiohead, Hanson, Puff Daddy, Winamp MP3s",
    "phone": "Nokia 6110 with Snake game",
    "video": "VHS & early Toshiba DVD players",
    "website": "Flash intros, scrolling marquee text, webrings",
    "fashion": "Baggy JNCO jeans, butterfly hair clips, tracksuits, bucket hats",
    "gadget": "Tamagotchi virtual pets & first commercial DVD players",
    "news": "Death of Princess Diana; Hong Kong handover to China",
    "culture": "James Cameron's Titanic breaks records; Harry Potter book one published"
  },
  "events": [
    "amazon-ipo-1997",
    "netflix-concept-1997",
    "bluetooth-1.0-1997",
    "realplayer-streaming-1997",
    "aim-launch-1997",
    "early-blogs-1997",
    "dvd-launched-1997",
    "w3c-css2-1997",
    "princess-diana-global-grief-1997",
    "tamagotchi-craze-1997",
    "radiohead-ok-computer-1997"
  ]
}
